wave	old_repo_path	old_concept	target_repo	target_root	action	future_repo	status	notes
Continuity informs session and memory posture; no old continuity engine port.	../yai/src/case/continuity/continuity	yai-core	system/case; engine/memory	case/session/memory	yes	none	complete	old_symbol_or_file=continuity_session.c; continuity_state.c; future_primitive=mine_concept; compat_required=NEW.18C
SPINE.20	../yai/Makefile	local build/install knobs and runtime path variables	yai-core	Makefile	mine_concept	none	inspected	read-only; old yai worktree has unrelated dirty architecture doc
SPINE.20	../yai/packaging/*	local package/runtime layout and semantic install surfaces	yai-core	packaging; docs/engineering/filesystem-target.md	mine_concept	none	inspected	extract PREFIX/bin, run, state/store, log and config path roles; no packaging folder copied
SPINE.20	../yai/tools/runtime/*	runtime service start/status/doctor and dev env layout	yai-core	cmd/yai; cmd/yaid; docs/engineering/testing.md	mine_concept	none	inspected	extract local runtime diagnostics and YAI_HOME-style path concepts only
SPINE.20	../yai/Documentation/manuals/runtime-service-operations.md	runtime service operation posture and fail-closed local runtime doctrine	yai-core	docs/engineering/current-status.md	mine_concept	none	inspected	service manager material deferred; foreground daemon only
SPINE.20	../yai/Documentation/product/distribution.md	local-first distribution posture without cloud-only claims	yai-core	README.md; docs/engineering/filesystem-target.md	mine_concept	none	inspected	distribution concepts only; no commercial installer implementation
SPINE.20	../yai/Documentation/reference/repository/*	repository ownership and install boundary evidence	yai-core	docs/engineering/four-repo-roadmap.md	mine_concept	none	inspected	old repository role is transition concept mine, not future core truth
SPINE.20	../yai/Documentation/manuals/README.md	manual boundary and operational guidance posture	yai-core	docs/engineering/testing.md	mine_concept	none	inspected	manuals are operating posture, not architecture authority
SPINE.20	../yai/Documentation/internal/architecture/core-spine/core-spine-series-2-wave-map.md	old-yai dirty architecture residue	yai-core	docs/internal/extraction-inventory.tsv	leave_untouched	none	blocked_by_dirty_worktree	existing user/unknown modification; no old-yai file changed
SPINE.20	../yai/packaging/services/*	service manager adapter material	none	none	externalize	ai-environment	deferred	launchd/systemd/service-manager material remains outside SPINE.20
SPINE.20	../yai/tools/runtime/embedded/*	embedded/runtime harness material	none	none	externalize	ai-environment	deferred	environment/lab harness material, not local runtime layout
SPINE.21	../yai/src/case/packs/*	pack intake, validation, binding, materialization, version, export and retire posture	yai-core	pack/materialization	mine_concept	none	inspected	read-only; concrete pack boundary concepts absorbed into docs/architecture/15-pack-materialization.md and docs/engineering/pack-format.md; no old source copied
SPINE.21	../yai/src/case/materialization/*	case materialization posture for structured input into case refs and residue	yai-core	case_world/pack_materialization	mine_concept	none	inspected	read-only; pack/input must become case-owned structure and substrate residue before operation
SPINE.21	../yai/src/case/policy/*	case-bound policy materialization, lifecycle, binding, conflict and trace posture	yai-core	control/policy_pack	mine_concept	none	inspected	read-only; policy pack concepts route to policy_material, policy_rule, authority_scope and obligations
SPINE.21	../yai/src/case/subjects/*	subject attachment, binding, classification, evidence trace, lifecycle and permissions posture	yai-core	case_world/subject_binding	mine_concept	none	inspected	read-only; subject material from packs remains case-world material before authority
SPINE.21	../yai/src/case/scope/*	domain scope, profile, applicability, registry and case binding posture	yai-core	pack/domain_scope	mine_concept	none	inspected	read-only; domain material maps to case_domain and domain-scoped pack materialization
SPINE.21	../yai/src/capabilities/*	capability families, bindings, protocol, registry, routing and runtime posture	yai-core + ai-environment	pack/tools; effect/control	split	ai-environment	inspected	read-only; tool hints may be pack material but executable/tool runtime belongs to later carrier or ai-environment boundaries
SPINE.21	../yai/src/agents/roles/*	role intake, reasoning and response posture for old agent roles	yai-core + ai-environment	pack/actors; ai-environment	split	ai-environment	inspected	read-only; actor posture may be materialized, agentic behavior remains externalized
SPINE.21	../yai/src/agents/composition/*	actor composition, role stack, context/model/policy/provider profiles	ai-environment	ai-environment	externalize	ai-environment	inspected	read-only; composition engine is future environment harness material, not core pack runtime
SPINE.21	../yai/src/models/frame/*	model frame, frame pack, projection, format and source requirement posture	yai-core	pack/projection/model_frame	mine_concept	none	inspected	read-only; frame pack concepts route to pack projection rules, output schemas and authority wording
SPINE.21	../yai/src/substrate/sources/*	source, policy, normative, domain, provenance and lifecycle posture	yai-core	pack/materials	mine_concept	none	inspected	read-only; source material becomes pack materials with provenance and materialization rules
SPINE.21	../yai/src/substrate/views/*	view/projection, freshness, provenance, materialization, refresh and rebuild posture	yai-core	pack/projections	mine_concept	none	inspected	read-only; view concepts route to pack-derived projection templates and future projection facts
